"employee","skills","position"
"Adam Smith","r, sql, management, excel,tableau, economics, statistics","project manager"
"David Ricardo","r, sql, management, excel,tableau, statistics","business intelligence analyst"
"John Maynard","r, excel, economics, modeling, statistics, hadoop, machine learning","quality assurance engineer"
"Friedrich H.","r, python, sql, management, excel, statistics, analytics","data analyst"
"Modigliani Miller","r, python, sql, management, excel,  financial services, finance, statistics, analytics","data analyst"
